{
  "cycle": "C-398",
  "date": "2026-08-09",
  "writer": "mobius-bot/state-sync",
  "narrative": null,
  "ledger_verified": true,
  "ledger_snapshot": {
    "cycle": "unknown",
    "gi": null,
    "attested_at": "2026-08-09T05:10:49.723332+00:00"
  },
  "ledger_snapshot_at": "2026-08-09T05:15:06Z",
  "ledger_witness_url": "https://civic-protocol-core-ledger.onrender.com/pulse/state",
  "ledger_gi_attested": false,
  "ledger_gi_withheld_reason": "GI_NULL_IN_PULSE",
  "ledger_health_ephemeral": false
}
